{
  "id": "com.example.java",
  "name": "Java_Load Example",
  "version": "1.0.0",
  "enabled": true,
  "nodes": [
    {
      "languageType": "com.example.java.run",
      "title": "Java Execute",
      "category": "SDK/Java",
      "description": "Java外部プロセスABIテスト",
      "inputs": [
        {
          "id": "value",
          "label": "Value",
          "dataType": "any",
          "required": true
        }
      ],
      "outputs": [
        {
          "id": "result",
          "label": "Result",
          "dataType": "object"
        }
      ],
      "defaultProperties": {},
      "runtime": {
        "kind": "external-process",
        "command": "java",
        "args": ["-jar", "sdk/templates/java/flow-java-plugin.jar"]
      }
    }
  ]
}
