{
  "id": "com.example.csharp",
  "name": "CSharp_Load Example",
  "version": "1.0.0",
  "enabled": true,
  "nodes": [
    {
      "languageType": "com.example.csharp.run",
      "title": "C# Execute",
      "category": "SDK/C#",
      "description": ".NET外部プロセスABIテスト",
      "inputs": [
        {
          "id": "value",
          "label": "Value",
          "dataType": "any",
          "required": true
        }
      ],
      "outputs": [
        {
          "id": "result",
          "label": "Result",
          "dataType": "object"
        }
      ],
      "defaultProperties": {},
      "runtime": {
        "kind": "external-process",
        "command": "dotnet",
        "args": ["sdk/templates/csharp/bin/Release/net8.0/CSharpPlugin.dll"]
      }
    }
  ]
}
