{
  "id": "com.flow.loader.python",
  "name": "Python_Load",
  "version": "1.0.0",
  "enabled": true,
  "description": "python JSON stdin/stdout ABI loader",
  "nodes": [
    {
      "languageType": "loader.python.execute",
      "title": "Python External",
      "category": "ローダー/Python",
      "inputs": [
        {
          "id": "payload",
          "label": "Payload",
          "dataType": "object",
          "required": true
        }
      ],
      "outputs": [
        {
          "id": "result",
          "label": "Result",
          "dataType": "object"
        }
      ],
      "defaultProperties": {},
      "runtime": {
        "kind": "external-process",
        "command": "python",
        "args": [
          "plugins/loaders/python_test.py"
        ]
      }
    }
  ]
}
